{
  "$schema": "http://json-schema.org/draft-07/schema#",
  "description": "Response schema for core_enrol_get_users_courses. Returns the list of courses where a user is enrolled in.",
  "type": "array",
  "items": {
    "title": "GetUsersByFieldResponse",
    "type": "object",
    "properties": {
      "country": {
        "nullable": true,
        "description": "Home country code of the user, such as AU or CZ",
        "type": "string"
      },
      "firstname": {
        "nullable": true,
        "description": "The first name(s) of the user",
        "type": "string"
      },
      "auth": {
        "nullable": true,
        "description": "Auth plugins include manual, ldap, etc",
        "type": "string"
      },
      "city": {
        "nullable": true,
        "description": "Home city of the user",
        "type": "string"
      },
      "timezone": {
        "nullable": true,
        "description": "Timezone code such as Australia/Perth, or 99 for default",
        "type": "string"
      },
      "idnumber": {
        "nullable": true,
        "description": "An arbitrary ID code number perhaps from the institution",
        "type": "string"
      },
      "phone2": {
        "nullable": true,
        "description": "Phone 2",
        "type": "string"
      },
      "description": {
        "nullable": true,
        "description": "User profile description",
        "type": "string"
      },
      "firstaccess": {
        "nullable": true,
        "description": "First access to the site (0 if never)",
        "type": "integer",
        "format": "int64"
      },
      "confirmed": {
        "nullable": true,
        "description": "Active user: 1 if confirmed, 0 otherwise",
        "type": "boolean"
      },
      "customfields": {
        "nullable": true,
        "description": "User custom fields (also known as user profile fields)",
        "title": "Custom Fields",
        "type": "array",
        "items": {
          "title": "Custom Field",
          "type": "object",
          "properties": {
            "name": {
              "description": "The name of the custom field",
              "type": "string"
            },
            "type": {
              "description": "The type of the custom field - text field, checkbox...",
              "type": "string"
            },
            "value": {
              "description": "The value of the custom field (as stored in the database)",
              "type": "string"
            },
            "displayvalue": {
              "nullable": true,
              "description": "The value of the custom field for display",
              "type": "string"
            },
            "shortname": {
              "description": "The shortname of the custom field - to be able to build the field class in the code",
              "type": "string"
            }
          },
          "required": [
            "type",
            "value",
            "name",
            "shortname"
          ]
        }
      },
      "phone1": {
        "nullable": true,
        "description": "Phone 1",
        "type": "string"
      },
      "trackforums": {
        "nullable": true,
        "description": "Whether the user is tracking forums",
        "type": "integer"
      },
      "profileimageurlsmall": {
        "description": "User image profile URL - small version",
        "type": "string",
        "format": "uri"
      },
      "institution": {
        "nullable": true,
        "description": "Institution",
        "type": "string"
      },
      "theme": {
        "nullable": true,
        "description": "Theme name such as 'standard', must exist on server",
        "type": "string"
      },
      "id": {
        "description": "ID of the user",
        "type": "integer",
        "format": "int64"
      },
      "department": {
        "nullable": true,
        "description": "Department",
        "type": "string"
      },
      "lang": {
        "nullable": true,
        "description": "Language code such as 'en', must exist on server",
        "type": "string"
      },
      "email": {
        "nullable": true,
        "format": "email",
        "description": "An email address - allow email as root@localhost",
        "type": "string"
      },
      "mailformat": {
        "nullable": true,
        "description": "Mail format code is 0 for plain text, 1 for HTML etc",
        "type": "integer",
        "javaEnums": [
          {
            "name": "MOODLE"
          },
          {
            "name": "HTML"
          },
          {
            "name": "PLAIN"
          },
          {
            "name": "MARKDOWN"
          }
        ],
        "enum": [
          0,
          1,
          2,
          4
        ]
      },
      "preferences": {
        "nullable": true,
        "description": "User preferences",
        "title": "Preferences",
        "type": "array",
        "items": {
          "title": "Preference",
          "type": "object",
          "properties": {
            "name": {
              "description": "The name of the preference",
              "type": "string"
            },
            "value": {
              "description": "The value of the preference",
              "type": "string"
            }
          },
          "required": [
            "name",
            "value"
          ]
        }
      },
      "address": {
        "nullable": true,
        "description": "Postal address",
        "type": "string"
      },
      "suspended": {
        "nullable": true,
        "description": "Suspend user account, either false to enable user login or true to disable it",
        "type": "boolean"
      },
      "lastname": {
        "nullable": true,
        "description": "The family name of the user",
        "type": "string"
      },
      "lastaccess": {
        "nullable": true,
        "description": "Last access to the site (0 if never)",
        "type": "integer",
        "format": "int64"
      },
      "calendartype": {
        "nullable": true,
        "description": "Calendar type such as 'gregorian', must exist on server",
        "type": "string"
      },
      "descriptionformat": {
        "nullable": true,
        "description": "int format (1 = HTML, 0 = MOODLE, 2 = PLAIN, or 4 = MARKDOWN)",
        "type": "integer",
        "javaEnums": [
          {
            "name": "MOODLE"
          },
          {
            "name": "HTML"
          },
          {
            "name": "PLAIN"
          },
          {
            "name": "MARKDOWN"
          }
        ],
        "enum": [
          0,
          1,
          2,
          4
        ]
      },
      "fullname": {
        "description": "The fullname of the user",
        "type": "string"
      },
      "initials": {
        "description": "The initials of the user",
        "type": "string"
      },
      "profileimageurl": {
        "description": "User image profile URL - big version",
        "format": "uri",
        "type": "string"
      },
      "interests": {
        "nullable": true,
        "description": "User interests (separated by commas)",
        "type": "string"
      },
      "username": {
        "nullable": true,
        "description": "The username",
        "type": "string"
      }
    },
    "required": [
      "id",
      "fullname",
      "profileimageurlsmall",
      "profileimageurl"
    ]
  }
}
