[
  {
    "id": 13,
    "username": "teacher",
    "firstname": "Jeffrey",
    "lastname": "Sanders",
    "fullname": "Jeffrey Sanders",
    "initials": "JS",
    "email": "jeffreysanders199@example.com",
    "department": "Senior staff, SE",
    "interests": "travel, gardening, chess, peace, politics, Films, history",
    "firstaccess": 1276064220,
    "lastaccess": 1792955981,
    "auth": "manual",
    "suspended": false,
    "confirmed": true,
    "lang": "en",
    "theme": "",
    "timezone": "99",
    "mailformat": 1,
    "trackforums": 0,
    "description": "<p>The world and its environment has been going through an enormous upheaval particularly in the last few decades. We need to develop thinkers who will be creative, engaged, skilled, informed and thoughtful about the past, present and future interactions of people with each other and their environment. I am passionate about education and enjoy my role at Mount Orange.</p>",
    "descriptionformat": 1,
    "city": "Orange City",
    "country": "AU",
    "profileimageurlsmall": "https://school.moodledemo.net/pluginfile.php/160/user/icon/boost/f2?rev=75854",
    "profileimageurl": "https://school.moodledemo.net/pluginfile.php/160/user/icon/boost/f1?rev=75854",
    "preferences": [
      {
        "name": "assign_filter",
        "value": ""
      },
      {
        "name": "assign_markerfilter",
        "value": ""
      },
      {
        "name": "assign_perpage",
        "value": "20"
      },
      {
        "name": "assign_quickgrading",
        "value": "0"
      },
      {
        "name": "assign_workflowfilter",
        "value": ""
      },
      {
        "name": "assignment_mailinfo",
        "value": "0"
      },
      {
        "name": "auth_forcepasswordchange",
        "value": "0"
      },
      {
        "name": "auth_manual_passwordupdatetime",
        "value": "1777287663"
      },
      {
        "name": "block_myoverview_hidden_course_56",
        "value": "1"
      },
      {
        "name": "block_myoverview_hidden_course_57",
        "value": "1"
      },
      {
        "name": "block_myoverview_hidden_course_6",
        "value": "1"
      },
      {
        "name": "block_myoverview_hidden_course_67",
        "value": "1"
      },
      {
        "name": "block_myoverview_last_tab",
        "value": "timeline"
      },
      {
        "name": "block_myoverview_user_grouping_preference",
        "value": "all"
      },
      {
        "name": "block_myoverview_user_view_preference",
        "value": "cards"
      },
      {
        "name": "block_timeline_user_filter_preference",
        "value": "next6months"
      },
      {
        "name": "block262hidden",
        "value": "0"
      },
      {
        "name": "block263hidden",
        "value": "0"
      },
      {
        "name": "block694hidden",
        "value": "0"
      },
      {
        "name": "calendar_savedflt",
        "value": "13"
      },
      {
        "name": "core_message_migrate_data",
        "value": "1"
      },
      {
        "name": "core_user_welcome",
        "value": "1649737736"
      },
      {
        "name": "course_overview_course_sortorder",
        "value": "62,66,59,64,56,63,35,41,27,58,49,51,40,60,38"
      },
      {
        "name": "course_overview_number_of_courses",
        "value": "7"
      },
      {
        "name": "coursesectionspreferences_59",
        "value": "{\"indexcollapsed\":[459]}"
      },
      {
        "name": "coursesectionspreferences_69",
        "value": "{\"contentcollapsed\":{\"3\":557}}"
      },
      {
        "name": "coursesectionspreferences_73",
        "value": "{\"contentcollapsed\":[]}"
      },
      {
        "name": "coursesectionspreferences_75",
        "value": "{\"contentcollapsed\":[602,601,600,599]}"
      },
      {
        "name": "data_perpage_1",
        "value": "50"
      },
      {
        "name": "docked_block_instance_242",
        "value": "0"
      },
      {
        "name": "docked_block_instance_262",
        "value": "0"
      },
      {
        "name": "docked_block_instance_263",
        "value": "0"
      },
      {
        "name": "docked_block_instance_4",
        "value": "0"
      },
      {
        "name": "docked_block_instance_5",
        "value": "0"
      },
      {
        "name": "docked_block_instance_694",
        "value": "0"
      },
      {
        "name": "docked_block_instance_702",
        "value": "1"
      },
      {
        "name": "docked_block_instance_758",
        "value": "0"
      },
      {
        "name": "docked_block_instance_761",
        "value": "0"
      },
      {
        "name": "docked_block_instance_834",
        "value": "0"
      },
      {
        "name": "docked_block_instance_838",
        "value": "1"
      },
      {
        "name": "docked_block_instance_868",
        "value": "0"
      },
      {
        "name": "drawer-open-block",
        "value": "0"
      },
      {
        "name": "drawer-open-index",
        "value": "0"
      },
      {
        "name": "filepicker_recentlicense",
        "value": "unknown"
      },
      {
        "name": "filepicker_recentrepository",
        "value": "4"
      },
      {
        "name": "flextable_mod_assign_grading",
        "value": "{\"collapse\":[],\"sortby\":{\"timesubmitted\":3,\"userid\":4},\"i_first\":\"\",\"i_last\":\"\",\"textsort\":[]}"
      },
      {
        "name": "forum_displaymode",
        "value": "3"
      },
      {
        "name": "forum_markasreadonnotification",
        "value": "1"
      },
      {
        "name": "forum_useexperimentalui",
        "value": "0"
      },
      {
        "name": "grade_report_showonlyactiveenrol",
        "value": "1"
      },
      {
        "name": "gradingform_guide-showmarkerdesc",
        "value": "1"
      },
      {
        "name": "gradingform_guide-showstudentdesc",
        "value": "1"
      },
      {
        "name": "htmleditor",
        "value": ""
      },
      {
        "name": "ifirst",
        "value": ""
      },
      {
        "name": "ilast",
        "value": ""
      },
      {
        "name": "last_time_enrolments_synced",
        "value": "1792954899"
      },
      {
        "name": "login_failed_count_since_success",
        "value": "0"
      },
      {
        "name": "message_beepnewmessage",
        "value": "0"
      },
      {
        "name": "message_blocknoncontacts",
        "value": "0"
      },
      {
        "name": "message_processor_email_email",
        "value": "jeffreysanders199@example.com"
      },
      {
        "name": "message_provider_enrol_manual_expiry_notification_enabled",
        "value": "email"
      },
      {
        "name": "message_provider_enrol_self_expiry_notification_enabled",
        "value": "email"
      },
      {
        "name": "message_provider_mod_assign_assign_notification_enabled",
        "value": "email"
      },
      {
        "name": "message_provider_mod_feedback_message_enabled",
        "value": "email"
      },
      {
        "name": "message_provider_mod_feedback_submission_enabled",
        "value": "email"
      },
      {
        "name": "message_provider_mod_forum_posts_enabled",
        "value": "email,popup"
      },
      {
        "name": "message_provider_mod_lesson_graded_essay_enabled",
        "value": "email"
      },
      {
        "name": "message_provider_moodle_badgecreatornotice_enabled",
        "value": "email"
      },
      {
        "name": "message_provider_moodle_badgerecipientnotice_enabled",
        "value": "email,popup"
      },
      {
        "name": "message_provider_moodle_courserequestapproved_enabled",
        "value": "email"
      },
      {
        "name": "message_provider_moodle_courserequestrejected_enabled",
        "value": "email"
      },
      {
        "name": "message_provider_moodle_errors_enabled",
        "value": "email,popup"
      },
      {
        "name": "message_provider_moodle_instantmessage_enabled",
        "value": "email,popup"
      },
      {
        "name": "message_provider_moodle_notices_enabled",
        "value": "email,popup"
      },
      {
        "name": "message_provider_tool_messageinbound_invalidrecipienthandler_enabled",
        "value": "email"
      },
      {
        "name": "message_provider_tool_messageinbound_messageprocessingerror_enabled",
        "value": "email"
      },
      {
        "name": "message_provider_tool_messageinbound_messageprocessingsuccess_enabled",
        "value": "email"
      },
      {
        "name": "message_provider_tool_monitor_notification_enabled",
        "value": "popup"
      },
      {
        "name": "mod_imscp_mod_form_showadvanced",
        "value": "1"
      },
      {
        "name": "mod_wiki_mod_form_showadvanced",
        "value": "1"
      },
      {
        "name": "qbank_managecategories_includesubcategories_filter_default",
        "value": "0"
      },
      {
        "name": "qtype_multichoice_answernumbering",
        "value": "none"
      },
      {
        "name": "qtype_multichoice_defaultmark",
        "value": "1"
      },
      {
        "name": "qtype_multichoice_penalty",
        "value": "0.3333333"
      },
      {
        "name": "qtype_multichoice_showstandardinstruction",
        "value": "0"
      },
      {
        "name": "qtype_multichoice_shuffleanswers",
        "value": "1"
      },
      {
        "name": "qtype_multichoice_single",
        "value": "1"
      },
      {
        "name": "qtype_ordering_defaultmark",
        "value": "1"
      },
      {
        "name": "qtype_ordering_gradingtype",
        "value": "0"
      },
      {
        "name": "qtype_ordering_layouttype",
        "value": "1"
      },
      {
        "name": "qtype_ordering_numberingstyle",
        "value": "none"
      },
      {
        "name": "qtype_ordering_penalty",
        "value": "0.3333333"
      },
      {
        "name": "qtype_ordering_selectcount",
        "value": "2"
      },
      {